CILINDRO DE RUEDA PRENCO;;;;;;;;;;;
Codigo;DESCRIPCIÓN;CANTIDAD;MEDIDA;MEDIDA;MEDIDA;C0STO ;PRECIO CARACAS;PRECIO ORIEMTE;CATEGORIA;EQUIVALENCIA;MARCA
F13387;Cilindro de Rueda Chevrolet Blazer, C10, C15, C30 (69/73), Impala (60/64), Trasero Izquierdo.;;"1""";;;5,00;11,11;12,50;CILINDRO DE RUEDA ;WC13387;PRENCO
F13388;Cilindro de Rueda Chevrolet Blazer, C10, C15, C30 (69/73), Impala (60/64), Trasero Derecho.;;"1""";;;5,00;11,11;12,50;CILINDRO DE RUEDA ;WC13388;PRENCO
F24489;Cilindro de Rueda IHC International Truck Series: 160, 1600, 1650, Chevolet Truck Series: 60, 600, 6000 (1980), Ford F-750 Series (65/78), Trasero.;;"1-5/8""";;;5,00;11,11;12,50;CILINDRO DE RUEDA ;WC24489;PRENCO
F28805;Cilindro de Rueda Fairlane 500, Falcon, LTD (62/71), Mustang (64/72), Thunderbird (59/60), Torino, Gran Torino (67/71) Trasero Derecho.;;"29/32""";;;5,00;11,11;12,50;CILINDRO DE RUEDA ;WC36020;PRENCO
F34876;"Cilindro de Rueda Dodge Dart (63/76), Valiant (60/76), Ford Fairmont, Zephyr (78/83), Falcon (60/65), LTD (83/86), Javelin (1972) Trasero,   Bandas 9""";;"13/16""";;;5,00;11,11;12,50;CILINDRO DE RUEDA ;WC34876;PRENCO
F45873;Cilindro de Rueda Chevrolet Camaro (67/75), Caprice (77/96), Impala (77/85), Malibú, Monte Carlo (70/75), Nova (67/75);;"7/8""";;;5,00;11,11;12,50;CILINDRO DE RUEDA ;WC37024;PRENCO
F45997;Cilindro de Rueda Chverolet Blazer (69/70), C10, C15 (64/71), Jimmy (70/72) Delantero Izquierdo.;;"1-1/8""";;;5,00;11,11;12,50;CILINDRO DE RUEDA ;;PRENCO
F49331;Cilindro de Rueda Ford Falcon (66/70), Maverick (70/72), Mustang (64/70) Trasero.;;"27/32""";;;5,00;11,11;12,50;CILINDRO DE RUEDA ;WC37108;PRENCO
F71210;Cilindro de Rueda Malibú (68/72), Monte Carlo (1970) Delantero Izquierdo.;;"1-1/8""";;;5,00;11,11;12,50;CILINDRO DE RUEDA ;WC37112;PRENCO
F71211;Cilindro de Rueda Malibú (68/72), Monte Carlo (1970) Delantero Derecho.;;"1-1/8""";;;5,00;11,11;12,50;CILINDRO DE RUEDA ;WC37113;PRENCO
F78978;Cilindro de Rueda Ford Conquistador (74/79), Country Squire (73/91), Galaxie 500 (73/74), LTD (73/78) Trasero.;;"1""";;;5,00;11,11;12,50;CILINDRO DE RUEDA ;WC37271;PRENCO
F79985;Cilindro de Rueda Ford Falcon (60/74), Mustang (74/78), AMC Hornet (71/76), Javelin (71/74) Trasero.;;"7/8""";;;5,00;11,11;12,50;CILINDRO DE RUEDA ;WC37029;PRENCO
F90549;   Cilindro de Rueda Volkswagen Beetle Escarabajo, (68/78) Delantero;;"7/8""";;;7,50;16,67;18,75;CILINDRO DE RUEDA ;WC37109;PRENCO
F96615;Cilindro de Rueda Carcasa de Aluminio Nissan series: Maxima;;22.2mm;;;5,00;11,11;12,50;CILINDRO DE RUEDA ;;PRENCO
F96774;Cilindro de Rueda Toyota Pickup 4x4 (75/83) Trasero.;;"11/16""";;;5,00;11,11;12,50;CILINDRO DE RUEDA ;WC37375;PRENCO
F96846;Cilindro Toyota Pickup 4x2 (79/93), Previa (92/96) Trasero.;;"7/8""";;;5,00;11,11;12,50;CILINDRO DE RUEDA ;WC47420;PRENCO
F106492;"Cilindro de Rueda Ford: Aerostar (86/89), Bronco II (83/89), Ranger (83/97), Mazda Pickup B2300/2500/3000/4000 (97/98) Bandas de  9""";;"3/4""";;;5,00;11,11;12,50;CILINDRO DE RUEDA ;;PRENCO
F106911;Cilindros de Rueda Renault R5 LeCar (76/83) Trasero.;;21.9mm;;;5,00;11,11;12,50;CILINDRO DE RUEDA ;WC37450;PRENCO
F107475;Cilindro de Rueda Dodge LeBaron (84/86), New Yorker, Town & Country (83/88);;"9/16""";;;5,00;11,11;12,50;CILINDRO DE RUEDA ;WC37590;PRENCO
F107476;Cilindro de Rueda Dodge LeBaron (82/91), Neon (95/99);;"5/8""";;;5,00;11,11;12,50;CILINDRO DE RUEDA ;WC37564;PRENCO
F108106;Cilindro de Rueda Hyundai Series : Accent, Excel, Elantra Trasero Izquierdo.;;"7/8""";;;5,00;11,11;12,50;CILINDRO DE RUEDA ;WC37592;PRENCO
F108107;Cilindro de Rueda Hyundai Series: Accent, Excel, Elantra Trasero Derecho.;;"7/8""";;;5,00;11,11;12,50;CILINDRO DE RUEDA ;WC37591;PRENCO
F108537;Cilindro de Rueda Honda Accord (82/85), Prelude 83 ;;"3/4""";;;5,00;11,11;12,50;CILINDRO DE RUEDA ;WC37584;PRENCO
F109532;Cilindro de Rueda Dodge Caravan (84/95), Jeep Cherokee (90/96), Comanche (90/91), Voyager (84/95), Wagoneer (90);;"3/4""";;;5,00;11,11;12,50;CILINDRO DE RUEDA ;WC37844;PRENCO
F110260;Cilindro de Rueda Chevrolet Malibú (78/83), Monte Carlo (78/88) Trasero;;"3/4""";;;6,00;13,33;15,00;CILINDRO DE RUEDA ;WC37625;PRENCO
F110261;Cilindro de Rueda, S & T10 Blazer (82/88), Pickup, Jimmy (82/88);;"7/8""";;;5,00;11,11;12,50;CILINDRO DE RUEDA ;WC37644;PRENCO
F110873;Cilindros de Rueda Ford Bronco II (84/90), Ranger (84/94) Trasero.;;"13/16""";;;5,00;11,11;12,50;CILINDRO DE RUEDA ;WC37640;PRENCO
F112409;"Cilindro de Rueda Ford: Aerostar (86/89), Ranger (87/94), Mazda Pickup B2300/3000/4000  Zapatas 10x2-1/2""                ";;"13/16""";;;5,00;11,11;12,50;CILINDRO DE RUEDA ;;PRENCO
F113468;Cilindro de Rueda Chevrolet Series: Cavalier,Celebrity,Century 84/87 Con Grapa ;;"13/16""";;;6,00;13,33;15,00;CILINDRO DE RUEDA ;;PRENCO
F116263;Cilindro de Rueda Chevrolet Series: C10, C15 Pickup (88/92), C20 Pickup (88), Grand Blazer (93/94);;"1-1/8""";;;5,00;11,11;12,50;CILINDRO DE RUEDA ;WC37784;PRENCO
F118300;Cilindro de Rueda Suzuki Sidekick Jeep,Tracker (89/90) Trasero Izquierdo.;;23.81mm;;;5,00;11,11;12,50;CILINDRO DE RUEDA ;WC37803;PRENCO
F118301;Cilindro de Rueda Suzuki Sidekick Jeep, Tracker (89/90) Trasero Derecho.;;23.81mm;;;5,00;11,11;12,50;CILINDRO DE RUEDA ;WC37802;PRENCO
F122406;Cilindro de Rueda Ford Explorer (91/94) Trasero.;;"7/8""";;;5,00;11,11;12,50;CILINDRO DE RUEDA ;WC37856;PRENCO
F128183;Cilindro de Rueda Honda Accord (1989) Trasero.;;"13/16""";;;5,00;11,11;12,50;CILINDRO DE RUEDA ;WC37845;PRENCO
F131650;Cilindro de Rueda Subaru Forester (98), Impreza (93) Trasero.;;"3/4""";;;5,00;11,11;12,50;CILINDRO DE RUEDA ;WC37983;PRENCO
;Cilindro de Rueda Chrysler/Dodge, Town & Country Van, Dodge Caravan, Voyager (94/95)  (Tracciòn Delantera)         ;;"11/16""";;;5,00;11,11;12,50;CILINDRO DE RUEDA ;WC83031;PRENCO
;"Cilindro De Rueda Lada series:Samara,Niva;Fiat series: Uno,Spazio,147 Tucán Rosca Gruesa";;;;;6,00;13,33;15,00;CILINDRO DE RUEDA ;;PRENCO
;   Cilindro de Rueda Volkswagen Beetle Escarabajo, (71/75) Delantero/Tras.;;23mm;;;7,50;16,67;18,75;CILINDRO DE RUEDA ;WC37216;PRENCO
;;;;;;;;;;;
;;;;;;;;;;;
CILINDRO DE RUEDA XC;;;;;;;;;;;
CODIGO;DESCRIPCIÓN;;MEDIDAS ;;;C0STO ;PRECIO CARACAS;PRECIO ORIEMTE;;;
CF022000L;Cilindro de Rueda Chevrolet Aveo;;"13/16""";;;9,00;20,00;22,50;CILINDRO DE RUEDA ;;XC
;Cilindro de Rueda Chevrolet Silverado (2006/2009) carcasa de aluminio;;22mm;;;12,00;26,67;30,00;CILINDRO DE RUEDA ;37785;XC
;Cilindro de Rueda Volkswagen Jetta/Golf (79/92) Trasero. ;;"11/16""";;;8,40;18,67;21,00;CILINDRO DE RUEDA ;;XC
 ;Cilindro de Rueda Chevrolet Corsa;;"11/16""";;;0;0,00;0,00;CILINDRO DE RUEDA ;;XC
WC15533;Cilindro de Rueda Chevrolet Silverado/Colorado (2009/2013);;"15/16""";;;10,00;22,22;25,00;CILINDRO DE RUEDA ;;XC
;Cilindro de Rueda Renault Twingo;;20,64mm;;;9,00;20,00;22,50;CILINDRO DE RUEDA ;WC39467;XC
WC37250;Cilindro de rueda Ford Series: F350 87/92 Tras. Izq.;;"1-3/16""";;;15,00;33,33;37,50;CILINDRO DE RUEDA ;WC37250;XC
WC37251;Cilindro de rueda Ford Series: F350 87/92 Tras. Der.;;"1-3/16""";;;15,00;33,33;37,50;CILINDRO DE RUEDA ;WC37251;XC
WC37646;Cilindro De Rueda Toyota Corolla Tras. Der.;;"11/16""";;;9,00;20,00;22,50;CILINDRO DE RUEDA ;WC37646;XC
WC37637;Cilindro De Rueda Toyota Corolla Tras. Izq.;;"11/16""";;;9,00;20,00;22,50;CILINDRO DE RUEDA ;WC37637;XC
F116229;Cilindro de Rueda Ford Festiva 88/93;;"5/8""";;;8,50;18,89;21,25;CILINDRO DE RUEDA ;;XC
WC37866;Cilindro de rueda Mitsubishi Series: Mirage,Lancer 91/95;;"3/4""";;;9,00;20,00;22,50;CILINDRO DE RUEDA ;;XC
WC129595;Cilindro de rueda Mitsubishi Lancer 2003/2012, Chery Arauca,Nissan Serie D15;;"3/4""";;;9,00;20,00;22,50;CILINDRO DE RUEDA ;;XC
WC890988;Cilindro de Rueda Chevrolet Silverado Año 2007 Cabina Doble;;" 1-1/16""";;;12,00;26,67;30,00;CILINDRO DE RUEDA ;;XC
;;;;;;;;;;;
;;;;;;;;;;;
CILINDRO DE RUEDA WOLF ITALY ;;;;;;REFERENCIA O EQUIVALENCIA ;;;;;
CODIGO;DESCRIPCIÓN;;MEDIDAS ;;;C0STO ;PRECIO CARACAS;PRECIO ORIEMTE;;;
1161;Cilindro de Rueda Fiat series: Strada Pickup;;"19""";;;15,00;33,33;37,50;CILINDRO DE RUEDA ;;WOLF ITALY
1282;Cilindro de Rueda Chevrolet Silverado/Colorado, (2009/2013);;"15/16""";;;10,00;22,22;25,00;CILINDRO DE RUEDA ;;WOLF ITALY
1294;Cilindro de Rueda Chevrolet Aveo ;;"13/16""";;;10,00;22,22;25,00;CILINDRO DE RUEDA ;;WOLF ITALY
2028;Cilindro de Rueda Renault series: Kangoo Carcasa de Aluminio;;22mm;;;20,00;44,44;50,00;CILINDRO DE RUEDA ;;WOLF ITALY
2060;Cilindro de Rueda Chevrolet Spark, Daewoo Matiz;;17.46mm;;;15,00;33,33;37,50;CILINDRO DE RUEDA ;;WOLF ITALY
2078;Cilindro de Rueda Renault series: Clio Carcasa de Aluminio;;17.46mm;;;20,00;44,44;50,00;CILINDRO DE RUEDA ;;WOLF ITALY
2164;Cilindro de Rueda Toyota Land Cruiser, 4 Runner, Hiace;;"1""";;;10,00;22,22;25,00;CILINDRO DE RUEDA ;;WOLF ITALY
2245;Cilindro de Rueda Chevrolet Corsa;;"11/16""";;;0,00;0,00;0,00;CILINDRO DE RUEDA ;;WOLF ITALY
2248;Cilindro de Rueda Chevrolet series: Aveo, Astra. Daewoo Series: Matiz, Cielo, Espero, Lanos, Racer,Corsa;;"3/4""";;;9,00;20,00;22,50;CILINDRO DE RUEDA ;;WOLF ITALY
2326;Cilindro de Rueda Volkswagen Fox, Golf Carcasa de Aluminio;;17.46mm;;;15,00;33,33;37,50;CILINDRO DE RUEDA ;;WOLF ITALY
2564;KIA SERIES:RIO STYLUS;;17.46mm;;;10,00;22,22;25,00;CILINDRO DE RUEDA ;;WOLF ITALY
2693;Cilindro de Rueda Renault Twingo;;20.64mm;;;13,50;30,00;33,75;CILINDRO DE RUEDA ;;WOLF ITALY
2696;Cilindro de Rueda Renaut Logan;;17.46mm;;;15,00;33,33;37,50;CILINDRO DE RUEDA ;;WOLF ITALY
2912;Cilindro de Rueda Volks series: Gol, Jetta, Passat, Golf, Polo;;17.46mm;;;8,00;17,78;20,00;CILINDRO DE RUEDA ;;WOLF ITALY
2913;Cilindro de Rueda Volkswagen series: Golf, Jetta, Passat;;14.28mm;;;8,00;17,78;20,00;CILINDRO DE RUEDA ;;WOLF ITALY
;;;;;;;;;;;
;;;;;;;;;;;
BOMBA DE FRENO ;;;;;;REFERENCIA O EQUIVALENCIA ;;;;;
CODIGO;DESCRIPCIÓN;;MEDIDAS ;;;C0STO ;PRECIO CARACAS;PRECIO ORIEMTE;;;
7803;Bomba de Frenos Volkswagen Jetta/Golf (90/92), Fiat Tempra, Renault series: R-19/21, Twingo de 4 salidas;;20.64mm;;;54,00;120,00;135,00;BOMBA DE FRENO ;;
;Bomba de Freno Chevrolet: Malibu, C-10 (71/87), Jeep Wagoneer (74/79) = 101254;;"1-1/8""";;;0,00;0,00;0,00;BOMBA DE FRENO ;;Q Brake
;Bomba de Freno Dodge: Aspen, Dart, Coronet (71/78);;"1-1/32""";;;0,00;0,00;0,00;BOMBA DE FRENO ;;Q Brake
;Bomba de Frenos Chevrolet series: C-20, C-30;;"1-1/4""";;;0,00;0,00;0,00;BOMBA DE FRENO ;;Coni-Seal
BF-32069901;Bomba de Frenos Cheyenne 1500, Silverado, Avalanche, Tahoe (05/10);;"1""";;;0,00;0,00;0,00;BOMBA DE FRENO ;;TRW
QF-001;Bomba de Frenos Chevrolet Spark;;;;;32,00;71,11;80,00;BOMBA DE FRENO ;;Q Brake
QF-002;Bomba de Frenos Chevrolet Aveo-Optra ( 4 Tubos );;;;;50,30;111,78;125,75;BOMBA DE FRENO ;;Q Brake
QF-003;Bomba de Frenos Chevrolet Optra Design (07/12);;;;;0,00;0,00;0,00;BOMBA DE FRENO ;;Q Brake
QF-18014370-1;Bomba de Frenos Buick Century (92/93) Full Injection (12189);;;;;40,00;88,89;100,00;BOMBA DE FRENO ;;Q Brake
WC60581;Bomba de Frenos Chevrolet Aveo-Optra de 2 Conexiones;;;;;0,00;0,00;0,00;BOMBA DE FRENO ;;Q Brake
;;;;;;;;;;;
;;;;;;;;;;;
HIDROBOOSTER;;;;;;REFERENCIA O EQUIVALENCIA ;;;;;
CODIGO;DESCRIPCIÓN;MEDIDAS ;;;;C0STO ;PRECIO CARACAS;PRECIO ORIEMTE;;;
MXC100;Hidroboosters Para Ford Mustang 2002/2006;;;;;60,00;133,3;150,00;HIDROBOOSTER ;;
;;;;;;;;;;;
;;;;;;;;;;;
HIDROVACKS;;;;;;REFERENCIA O EQUIVALENCIA ;;;;;
CODIGO;DESCRIPCIÓN;MEDIDAS ;;;;C0STO ;PRECIO CARACAS;PRECIO ORIEMTE;;;
F2UZ2005-AX;Hidrovack para Ford series: F-350 (93/95);;;;;120,00;266,67;300,00;HIDROVACKS ;;Ford
F75Z-2005-GA;Hidrovack para Ford series: F-150 (99/04);;;;;120,00;266,67;300,00;HIDROVACKS ;;Ford
44610-09A10;Hidrovack para Toyota Corolla Explosion Nacional;;;;;120,00;266,67;300,00;HIDROVACKS ;;MXC
;;;;;;;;;;;
;;;;;;;;;;;
;;;;;;;;;;;
;;;;;;;;;;;
DISTRIBUIDORES DE LIGA MBM (USA);;;;;;;;;;;
Codigo de Fabricantes ;Descripción ;;;;;COSTO;CARACAS;ORIENTES;;EQUIVALENCIA;MARCA
PVM;Distribuidor en Bronce;;;;;60,00;133,33;150,00;DISTRIBUIDOR DE LIGA ;;
PVM-GMC;Distribuidor de Aluminio para Vehiculos GMC-Tahoe, Avalanche, Cheyenne 1500;;;;;42,00;93,33;105,00;DISTRIBUIDOR DE LIGA ;;
;;;;;;;;;;;
LIGA DE FRENO AC DELCO;;;;;;;;;;;
Codigo de Fabricantes ;Descripción ;;;;;COSTO;CARACAS;ORIENTES;;;
LF0,3LDOT3;Liga Bulto de 24 Unidades, Envases de 0,290 LTS;;;;;55,00;122,22;137,50;LIGA DE FRENO;;
LF0,3LDOT4;Liga Bulto de 24 Unidades, Envases de 0,290 Litros;;;;;57,50;127,78;143,75;LIGA DE FRENO;;
;;;;;;;;;;;
;;;;;;;;;;;
SILICONE KIT ;;;;;;;;;;;
Referencia ;Descripción ;;;;;COSTO;CARACAS;ORIENTES;;;
SILI;TUBO DE SILICON 5 GRS.KIT DE 2 UNIDADES;;;;;3,00;6,67;7,50;SILICONE ;;
;;;;;;;;;;;
;;;;;;;;;;;
;;;;;;;;;;;
;;;;;;;;;;;
;;;;;;;;;;;
;;;;;;;;;;;
;;;;;;;;;;;
;;;;;;;;;;;
;;;;;;;;;;;
;;;;;;;;;;;
;;;;;;;;;;;
;;;;;;;;;;;
;;;;;;;;;;;
;;;;;;;;;;;
;;;;;;;;;;;
;;;;;;;;;;;
;;;;;;;;;;;
;;;;;;;;;;;
;;;;;;;;;;;
;;;;;;;;;;;
;;;;;;;;;;;
;;;;;;;;;;;
;;;;;;;;;;;
;;;;;;;;;;;
;;;;;;;;;;;
;;;;;;;;;;;
;;;;;;;;;;;
;;;;;;;;;;;
;;;;;;;;;;;
;;;;;;;;;;;
;;;;;;;;;;;
;;;;;;;;;;;
;;;;;;;;;;;
;;;;;;;;;;;
PASTILLAS DE FRENO DASH4;;;;;;;;;;;
Referencia ;Descripción ;P.V.P $;CARACAS;ORIENTE;COSTO;CARACAS;ORIENTE;CATEGORIA;EQUIVALENCIA;MARCA;
CD976-7877;Pastillas de Frenos Toyota Series: 4Runner, Hilux 4x4 Kavak 4.0, Sequoia, Tundra (03/05) Delantera.;;;;45,50;101,11;113,75;PASTILLAS DE FRENO IMPORTADAS ;Cerámica;DASH4;
CD1273-8389;Pastillas de Frenos Jeep Series: Liberty (08/12) Delantera, Fórmula Cerámica;;;;57,50;127,78;143,75;PASTILLAS DE FRENO IMPORTADAS ;Cerámica;DASH5;
CD1303-8419;Pastillas de Frenos Toyota Series: Tundra, Delantera (07/19)                                                                    ;;;;50,00;111,11;125,00;PASTILLAS DE FRENO IMPORTADAS ;Cerámica;DASH6;
CD1455-8655;Pastillas de Frenos Jeep Series: Jeep Grand Cherokee (11/16) Delantera, Fórmula Cerámica;;;;67,50;150,00;168,75;PASTILLAS DE FRENO IMPORTADAS ;Cerámica;DASH7;
CD1508-8715;Pastillas De Frenos Ford Series: Explorer (2012) Delantera, Fórmula Cerámica;;;;55,00;122,22;137,50;PASTILLAS DE FRENO IMPORTADAS ;Cerámica;DASH8;
CD1611-8824;Pastillas De Frenos Ford Series: Explorer  (13/16) Delantera, Fórmula Cerámica;;;;57,50;127,78;143,75;PASTILLAS DE FRENO IMPORTADAS ;Cerámica;DASH9;
D52-728;Pastillas de Frenos Chevrolet Caprice (70/89) C-10 (71/86), Malibu (70/77) Jeep Wagoneer                                          ;;;;12,54;27,87;31,35;PASTILLAS DE FRENO IMPORTADAS ;Semi-Met.;DASH10;
D154-7070A;Pastillas de Frenos Chevrolet Malibu, Blazer, S10, Monte Carlo                                                              ;;;;12,54;27,86;31,34;PASTILLAS DE FRENO IMPORTADAS ;Semi-Met.;DASH11;
D436-7298A;Pastillas de Frenos  Toyota Macho, 4Runner, Hilux 4x4, Series Prado...                                                                   ;;;;22,50;50,00;56,25;PASTILLAS DE FRENO IMPORTADAS ;Semi-Met.;DASH12;
D606-7487;Pastillas de Frenos Toyota Land Cruiser (Burbuja) Trasera. ;;;;23,00;51,11;57,50;PASTILLAS DE FRENO IMPORTADAS ;Semi-Met.;DASH13;
D772-7639;Pastillas De Frenos Toyota series: Land Cruiser (Americano), 4Runner, Hilux 4x4, Semi Metálica;;;;30,00;66,67;75,00;PASTILLAS DE FRENO IMPORTADAS ;Semi-Met.;DASH14;
D924-7825;Pastillas De Frenos Hyundai Series: Tucson, Sonata 05, Tiburón, Elantra 07, Óptima, Sportage 06, Delantera, Semi Metálicas;;;;30,00;66,67;75,00;PASTILLAS DE FRENO IMPORTADAS ;Semi-Met.;DASH15;
D976-7877;Pastillas de Frenos Toyota Series: 4Runner, Hilux 4x4 Kavak 4.0, Sequoia,Tundra (03/05) Delantera.          ;;;;30,00;66,67;75,00;PASTILLAS DE FRENO IMPORTADAS ;Semi-Met.;DASH16;
D1035-7779;Pastillas de Frenos  Chevrolet Optra-Aveo (04/07)                                                                         ;;;;17,64;39,21;44,11;PASTILLAS DE FRENO IMPORTADAS ;Semi-Met.;DASH17;
D1522-8730 ;Pastillas de Frenos  Chevrolet Cruze (11/12) Delantera.                                                                        ;;;;27,39;60,87;68,48;PASTILLAS DE FRENO IMPORTADAS ;Semi-Met.;DASH18;
D1411-8523;Pastillas de Frenos Chevrolet C-3500 Delantera/Trasera (2011)                                                                      ;;;;26,00;57,78;65,00;PASTILLAS DE FRENO IMPORTADAS ;Semi-Met.;DASH19;
D1468-8668;Pastillas de Frenos Chevrolet Cruze (11/12) Trasera.                                                                       ;;;;21,36;47,46;53,39;PASTILLAS DE FRENO IMPORTADAS ;Semi-Met.;DASH20;
D1039-7943;Pastillas de Frenos Chevrolet Luv D-Max (2006) Delantra.                                                                       ;;;;20,89;46,43;52,23;PASTILLAS DE FRENO IMPORTADAS ;Semi-Met.;DASH21;
D1273-8389;Pastillas de Frenos Jeep Series: Liberty (08/12) Delantera, Semi Metálica;;;;35,00;77,78;87,50;PASTILLAS DE FRENO IMPORTADAS ;Semi-Met.;DASH22;
D1274-8390;Pastillas de Frenos Jeep Series: Liberty (08/12) Trasera, Semi Metálica;;;;35,00;77,78;87,50;PASTILLAS DE FRENO IMPORTADAS ;Semi-Met.;DASH23;
D1328-8440;Pastillas de Frenos Ford Econoline E-150 (2008) (Ambulancia) Delantera.                                                         ;;;;40,00;88,89;100,00;PASTILLAS DE FRENO IMPORTADAS ;Semi-Met.;DASH24;
D1329-8441;Pastillas de Frenos Ford Econoline E-150 (2008) (Ambulancia) Trasera.;;;;42,00;93,33;105,00;PASTILLAS DE FRENO IMPORTADAS ;Semi-Met.;DASH25;
D1333-7974;Pastillas de Frenos Ford F-250/350 Super Duty (2011) Delantera                                                                  ;;;;26,93;59,84;67,32;PASTILLAS DE FRENO IMPORTADAS ;Semi-Met.;DASH26;
D1334-8652/7973;Pastillas de Frenos Ford F-250/350 Super Duty (11/12) Trasera.                                                           ;;;;0,00;0,00;0,00;PASTILLAS DE FRENO IMPORTADAS ;Semi-Met.;DASH27;
D1391-8500;Pastillas De Frenos Toyota series: Sienna 18…, Highlander 19…, Trasera, Semi metálica;;;;35,00;77,78;87,50;PASTILLAS DE FRENO IMPORTADAS ;Semi-Met.;DASH28;
D1498-8698;Pastillas De Frens Jeep series: Grand Cherokee (11/16) Traseras, Semi Metálica;;;;35,00;77,78;87,50;PASTILLAS DE FRENO IMPORTADAS ;Semi-Met.;DASH29;
D1571-8780;Pastillas De Freno Toyota Series: Corolla (07/12), Delantera (7156) Semi Metálicas;;;;35,00;77,78;87,50;PASTILLAS DE FRENO IMPORTADAS ;Semi-Met.;DASH30;
D1572-8781;Pastillas De Freno Toyota Series: Corolla (07/12), Trasera (7157) Semi Metálicas;;;;30,00;66,67;75,00;PASTILLAS DE FRENO IMPORTADAS ;Semi-Met.;DASH31;
D1602-8816;Pastillas de Frenos Ford Series: F-150 (12/19), Ambulancia, Trasera                                                        ;;;;30,00;66,67;75,00;PASTILLAS DE FRENO IMPORTADAS ;Semi-Met.;DASH32;
D1612-8825;Pastillas De Frenos Ford Series: Explorer (13/16) Trasera, Semi Metálicas;;;;37,50;83,33;93,75;PASTILLAS DE FRENO IMPORTADAS ;Semi-Met.;DASH33;
D1680-8909;Pastillas De Frenos Ford F350 Super Duty (13/14) Delantera;;;;34,82;77,38;87,05;PASTILLAS DE FRENO IMPORTADAS ;Semi-Met.;DASH34;
D1691-8918;Pastillas De Frenos Ford F350 Super Duty (13/14) Trasera.;;;;31,11;69,13;77,77;PASTILLAS DE FRENO IMPORTADAS ;Semi-Met.;DASH35;
;;;;;;;;;;;
;;;;;;;;;;;
PASTILLAS DE FRENO GIC;;;;;;;;;;;
Referencia ;Descripción ;;;;P.V.P $;CARACAS;ORIENTE;;;;
D50-788;Pastilla de Freno Ford Series: F-150, Galaxie 500, Fairlane 500, Bronco (80);;;;10,81;24,03;27,03;PASTILLAS DE FRENO IMPORTADAS ;Semi-Met.;GIC;
D152-7072A;Pastilla de FrenoFord: Series Cougar/Zephyr/Fairmont;;;;11,64;25,86;29,09;PASTILLAS DE FRENO IMPORTADAS ;Semi-Met.;GIC;
D369-7259; Pastilla de Freno Chevrolet Grand Blazer/C-1500/Dodge Ram T-2500…98;;;;14,04;31,20;35,10;PASTILLAS DE FRENO IMPORTADAS ;Semi-Met.;GIC;
D465-7345;Pastilla de Freno Honda Series: Civic (00/04) Delantera.;;;;13,85;30,77;34,61;PASTILLAS DE FRENO IMPORTADAS ;Semi-Met.;GIC;
D497-7376;Pastilla de Freno Hyundai Accent, Excel.;;;;10,29;22,87;25,73;PASTILLAS DE FRENO IMPORTADAS ;Semi-Met.;GIC;
D537-7418;Pastilla de Freno Honda Series: Civic, Accord (2002) Trasera.;;;;13,85;30,77;34,61;PASTILLAS DE FRENO IMPORTADAS ;Semi-Met.;GIC;
D679-7558;Pastilla de FrenoFord Series: F-150 (96/00), Lariat (96/00) Triton 98 Delantera                                                        ;;;;12,18;27,06;30,44;PASTILLAS DE FRENO IMPORTADAS ;Semi-Met.;GIC;
D726-7593;Pastilla de Freno Chevrolet Blazer (99/01) Delantera.;;;;15,98;35,50;39,94;PASTILLAS DE FRENO IMPORTADAS ;Semi-Met.;GIC;
D756-7625;Pastilla de FrenoFord Series: F250/350 Super Duty Delantera (98/02);;;;21,13;46,94;52,81;PASTILLAS DE FRENO IMPORTADAS ;Semi-Met.;GIC;
D833-7706;Pastilla de FrenoFord Explorer (01/02) Delantera.;;;;12,57;27,93;31,42;PASTILLAS DE FRENO IMPORTADAS ;Semi-Met.;GIC;
D866-7741;Pastilla de Freno Mitsubishi Series: Lancer Touring 2.0 (08/13), Outlander (07/10), Galant (04/11), Chrysler, Dodge Sebring, Caliber (08/11);;;;14,06;31,25;35,15;PASTILLAS DE FRENO IMPORTADAS ;Semi-Met.;GIC;
D904-7782;Pastilla de Freno Mitsubishi Lancer 1.6 (02/08);;;;11,61;25,81;29,03;PASTILLAS DE FRENO IMPORTADAS ;Semi-Met.;GIC;
D1011-7915;Pastilla de Freno Ford Series: Tritòn F-150 4x4 (05/07) Delantera.;;;;13,30;29,56;33,26;PASTILLAS DE FRENO IMPORTADAS ;Semi-Met.;GIC;
D1037-7940;Pastilla de Freno Mitsubishi Lancer Touring 2.0 (08/11) Trasera.;;;;0,00;0,00;0,00;PASTILLAS DE FRENO IMPORTADAS ;Semi-Met.;GIC;
D1044-7947;Pastilla de Freno Mazda 3  1.6 y 2.0 cc, (04/07) / Mazda 5 (06/07) Delantera.;;;;14,93;33,17;37,32;PASTILLAS DE FRENO IMPORTADAS ;Semi-Met.;GIC;
D1092-7997;Pastilla de Freno Chevrolet Silverado 1500 (03/06), Cheyenne 1500 (05/06), Avalanche 2500, (2005) Delantera.                      ;;;;16,81;37,36;42,03;PASTILLAS DE FRENO IMPORTADAS ;Semi-Met.;GIC;
D1109-8214;Pastilla de Freno Ford Explorer (2010), Jeep Liberty (2004) Trasera.;;;;0,00;0,00;0,00;PASTILLAS DE FRENO IMPORTADAS ;Semi-Met.;GIC;
D1158-8268;Pastilla de Freno Ford Explorer (06/07) Delantera.;;;;16,32;36,26;40,79;PASTILLAS DE FRENO IMPORTADAS ;Semi-Met.;GIC;
D1169-8282;Pastilla de Freno Chevrolet Trail Blazer (06/07), Delantera.;;;;14,06;31,25;35,15;PASTILLAS DE FRENO IMPORTADAS ;Semi-Met.;GIC;
D1273-8389;Pastilla de Freno Jeep Liberty (08/12) Delantera.;;;;16,23;36,06;40,57;PASTILLAS DE FRENO IMPORTADAS ;Semi-Met.;GIC;
D1274-8390;Pastilla de Freno Jeep Liberty (08/12) Trasera.;;;;19,00;42,23;47,50;PASTILLAS DE FRENO IMPORTADAS ;Semi-Met.;GIC;
D1316-8430;Pastilla de FrenoIveco Truck Power Daily 50-12;;;;20,00;44,44;50,00;PASTILLAS DE FRENO IMPORTADAS ;Semi-Met.;GIC;
D1328-8440;Pastilla de FrenoFord Econoline E-150 (Ambulancia) (2008) Delantera.;;;;19,05;42,32;47,61;PASTILLAS DE FRENO IMPORTADAS ;Semi-Met.;GIC;
D1573-8783;Pastilla de Freno Mazda Series: BT-50 Pickup;;;;23,21;51,57;58,01;PASTILLAS DE FRENO IMPORTADAS ;Semi-Met.;GIC;
D1677-8906;Pastilla de Freno Luv D-Max (2014) Delantera.;;;;21,97;48,82;54,93;PASTILLAS DE FRENO IMPORTADAS ;Semi-Met.;GIC;
D1691-8918;Pastilla de Freno Ford F350 Super Duty (13/14) Trasera.;;;;23,88;53,06;59,69;PASTILLAS DE FRENO IMPORTADAS ;Semi-Met.;GIC;
;;;;;;;;;;;
;;;;;;;;;;;
PASTILLAS DE FRENO X-TENDER;;;;;;;;;;;
Referencia ;Descripción ;;;;P.V.P $;CARACAS;ORIENTE;;;;
E897A;Iveco Autobusete 70C16 HD;;;;54,17;120,38;135,43;PASTILLAS DE FRENO IMPORTADAS ;Semi-Met.;XTENDER;
;;;;;;;;;;;
;;;;;;;;;;;
PASTILLAS DE FRENO POWER BRAKE;;;;;;;;;;;
Referencia ;Descripción ;;;;P.V.P $;CARACAS;ORIENTE;;;;
7157;Pastilla de Freno Toyota Corolla 2.010 Trasera ;;;;10,00;22,22;25,00;PASTILLAS DE FRENO IMPORTADAS ;;;
D31-736;Pastillas de Frenos Chevrolet Chevette                                                                                   ;;;;6,66;14,80;16,65;PASTILLAS DE FRENO IMPORTADAS ;Semi-Met.;POWER BRAKE ;
D152-7072APB;Pastilla de Freno Cougar/Zephyr/Fairmont;;;;10,00;22,22;25,00;PASTILLAS DE FRENO IMPORTADAS ;Semi-Met.;;
D1175-8289PB;Pastilla de Freno Ford EcoSport;;;;11,65;25,89;29,13;PASTILLAS DE FRENO IMPORTADAS ;Semi-Met.;;
D1197-8317;Pastilla de Freno Fiat Ducato Delantera (Master Plus);;;;13,18;29,29;32,95;PASTILLAS DE FRENO IMPORTADAS ;Semi-Met.;;
;;;;;;;;;Semi-Met.;;
;;;;;;;;;;;
PASTILLAS DE FRENO Q-BRAKE;;;;;;;;;;;
Referencia ;Descripción ;;;;P.V.P $;CARACAS;ORIENTE;;;Q-BRAKE;
D84-7017A;Pastillas de Freno Dodge Aspen/Valiant/LeBaron;;;;11,14;24,76;27,86;PASTILLAS DE FRENO IMPORTADAS ;Semi-Met.;Q-BRAKE;
D86-7019;Pastillas de Freno Dodge Series: D100/200;;;;0;0,00;0,00;PASTILLAS DE FRENO IMPORTADAS ;Semi-Met.;Q-BRAKE;
D120-7054;Pastillas de Freno Ford Series: F-350 hasta (1994);;;;0;0,00;0,00;PASTILLAS DE FRENO IMPORTADAS ;Semi-Met.;Q-BRAKE;
D137-7069;Pastillas de Freno Toyota Macho Landcruiser/Samurai Station Wagon (86/88);;;;11,10;24,66;27,74;PASTILLAS DE FRENO IMPORTADAS ;Semi-Met.;Q-BRAKE;
D215-7136;Pastillas de Frenos Chevrolet Celebrity (83/90), Century (83/96) Delantera.;;;;11,61;25,79;29,02;PASTILLAS DE FRENO IMPORTADAS ;Semi-Met.;Q-BRAKE;
D402-7291;               Pastillas de Frenos Ford Festiva, Turpial Iranì, Mitsubishi Montero Trasera                                                            ;;;;7,86;17,47;19,65;PASTILLAS DE FRENO IMPORTADAS ;Semi-Met.;Q-BRAKE;
D449-7329;Pastillas De Frenos Hyundai Elantra, Tiburòn, (97/04) Delantera.;;;;13,6;30,22;34,00;PASTILLAS DE FRENO IMPORTADAS ;Semi-Met.;Q-BRAKE;
D464-7344;Pastillas De Frenos Hyundai Elantra, Tiburòn, (97/04), Kia Spectra Trasera.;;;;12,58;27,96;31,45;PASTILLAS DE FRENO IMPORTADAS ;Semi-Met.;Q-BRAKE;
D535-7417;               Pastillas de Frenos Mitsubishi Lancer/Dahiatsu Terios                                              ;;;;0;0,00;0,00;PASTILLAS DE FRENO IMPORTADAS ;Semi-Met.;Q-BRAKE;
D543-7081;Pastillas De Chevrolet Series: C-30, P31=7024;;;;0;0,00;0,00;PASTILLAS DE FRENO IMPORTADAS ;Semi-Met.;Q-BRAKE;
D606-7487;Pastilla de Freno Burbuja - Prado - Trasera (92/10);;;;12,58;27,96;31,45;PASTILLAS DE FRENO IMPORTADAS ;Semi-Met.;Q-BRAKE;
D642-7518A;Pastilla de Freno Neon - Intrepid Delantera (TODOS) ;;;;14,33;31,85;35,84;PASTILLAS DE FRENO IMPORTADAS ;Semi-Met.;Q-BRAKE;
